{
 "about": "The public shape of the source watch, exported by admin/build/export_watch.py. Counts and vocabularies only: no capture is copied.",
 "vault_id": "7r83qic5",
 "head": {
  "commit": "a4bb76c0a37b",
  "message": "researcher@php.newsroom: CISA adds CVE-2026-109618 and CVE-2026-109619 to the KEV catalog (26 October 2026, due 29 October): catalog and alert captured at 00:45 UTC on 27 October, the series kev-listed reads 2, a fourth statement in the ledger record is-it-exploited"
 },
 "commits": [
  {
   "commit": "a4bb76c0a37b",
   "message": "researcher@php.newsroom: CISA adds CVE-2026-109618 and CVE-2026-109619 to the KEV catalog (26 October 2026, due 29 October): catalog and alert captured at 00:45 UTC on 27 October, the series kev-listed reads 2, a fourth statement in the ledger record is-it-exploited"
  },
  {
   "commit": "dd7f4b06fce5",
   "message": "researcher@php.newsroom: tip 2026-10-26/001 (a LinkedIn post by Charles Carmakal on the PHP flaws, relayed by the editor as a screenshot; the post cropped, unverified) and a third statement in the ledger record is-it-exploited"
  },
  {
   "commit": "019866e54e9d",
   "message": "researcher@php.newsroom: OX Security's 'PHP2Shell day 5' added as a watched page (the editor's link; the capture is the bot-challenge page, a plain fetch and the browser both get 403); Cloudflare's post was already watched"
  },
  {
   "commit": "f212898aa0fe",
   "message": "researcher@php.newsroom: stealmybitcoin.com added as a watched page and captured (board correspondent-0005); the PoC repository on GitHub is not captured, by rule, pending the editor"
  },
  {
   "commit": "6c99788c3513",
   "message": "researcher@php.newsroom: pass 20261026T1703Z phase 2 of 2: discovery"
  },
  {
   "commit": "afb2422c5844",
   "message": "researcher@php.newsroom: pass 20261026T1703Z phase 1 of 2: captures, the curator queue, series and analysis"
  },
  {
   "commit": "aa0d4d7f77a5",
   "message": "researcher@php.newsroom: pass 20261026T1436Z phase 2 of 2: discovery"
  },
  {
   "commit": "681ce1ace707",
   "message": "researcher@php.newsroom: pass 20261026T1436Z phase 1 of 2: captures, the curator queue, series and analysis"
  },
  {
   "commit": "f12c7b82a7e8",
   "message": "researcher@php.newsroom: pass 20261026T1208Z phase 2 of 2: discovery"
  },
  {
   "commit": "7faaf95ef91b",
   "message": "researcher@php.newsroom: pass 20261026T1208Z phase 1 of 2: captures, the curator queue, series and analysis"
  },
  {
   "commit": "9987a9519704",
   "message": "researcher@php.newsroom: pass 20261026T0934Z phase 2 of 2: discovery"
  },
  {
   "commit": "f457bec575df",
   "message": "researcher@php.newsroom: pass 20261026T0934Z phase 1 of 2: captures, the curator queue, series and analysis"
  },
  {
   "commit": "2bb61c291708",
   "message": "researcher@php.newsroom: pass 20261026T0705Z phase 2 of 2: discovery"
  },
  {
   "commit": "b599857a4f65",
   "message": "researcher@php.newsroom: pass 20261026T0705Z phase 1 of 2: captures, the curator queue, series and analysis"
  },
  {
   "commit": "399f10950ffd",
   "message": "researcher@php.newsroom: pass 20261026T0125Z phase 3 of 3: discovery"
  },
  {
   "commit": "9ad94274d824",
   "message": "researcher@php.newsroom: pass 20261026T0125Z phase 2 of 3: series and analysis"
  },
  {
   "commit": "5619a889d98a",
   "message": "researcher@php.newsroom: pass 20261026T0125Z phase 1 of 3: captures and the curator queue"
  },
  {
   "commit": "4c59b212a5b7",
   "message": "researcher@php.newsroom: fix: tools/queue.py shadowed the standard library queue module (every tools/ script that imports it broke); renamed tools/curator_queue.py; pass.sh calls the new name. Also holds the few captures of a stopped test pass"
  },
  {
   "commit": "6efd721d847e",
   "message": "researcher@php.newsroom: pass.sh in three phases, each with its own commit and push (capture and the curator queue; series and analysis; discovery), a time line before every stage; tools/queue.py adds this pass's pages to the curator queue, idempotent"
  },
  {
   "commit": "4083a49ef208",
   "message": "researcher@php.newsroom: pass 20261025T1507Z"
  },
  {
   "commit": "0370c7b17b1e",
   "message": "researcher@php.newsroom: pass 20261025T1232Z"
  },
  {
   "commit": "f23987eb3b23",
   "message": "researcher@php.newsroom (scheduled): the 25 references of the Wikipedia article PHP2Shell that the watch did not hold are now watched pages (hourly) and captured once (run 20261025T114552Z: 19 open, 5 paywalled, 1 bot-challenge); brief 2026-10-25__brief__wikipedia-as-an-anchor"
  },
  {
   "commit": "a8300425e215",
   "message": "researcher@php.newsroom: pass 20261025T1002Z"
  },
  {
   "commit": "d0c1de046703",
   "message": "researcher@php.newsroom: pass 20261025T0732Z"
  },
  {
   "commit": "fae87065f668",
   "message": "researcher@php.newsroom: pass 20261024T1635Z"
  },
  {
   "commit": "8f3c26ca0ce9",
   "message": "researcher@php.newsroom: pass 20261024T1404Z"
  },
  {
   "commit": "4445a1c7afd3",
   "message": "researcher@php.newsroom: pass 20261024T1136Z"
  },
  {
   "commit": "cafe2d80e8d4",
   "message": "researcher@php.newsroom: pass 20261024T0907Z"
  },
  {
   "commit": "c856bdc40ed2",
   "message": "researcher@php.newsroom: pass 20261023T2347Z"
  },
  {
   "commit": "630988b9680c",
   "message": "researcher@php.newsroom: benchmark, a one-file push on the pack vault"
  },
  {
   "commit": "ae551123f08a",
   "message": "researcher@php.newsroom: pass 20261023T1631Z"
  },
  {
   "commit": "bff62f9dc08f",
   "message": "researcher@php.newsroom: scanner-noise angle (index/angles/scanner-noise.json, 7 new pages), job-03-community for Perplexity with its prompt, three new kinds, login-wall fix for Bluesky and LinkedIn search"
  },
  {
   "commit": "9066c155341b",
   "message": "researcher@php.newsroom: pass 20261023T0830Z"
  },
  {
   "commit": "999678bb70e3",
   "message": "researcher@php.newsroom: pass 20261023T0140Z"
  },
  {
   "commit": "15ea225c7d42",
   "message": "researcher@php.newsroom: external collectors: docs/collectors.md, jobs/collectors/job-01-vantage.json, taxonomy/collector-report.schema.json, tools/collectors.py; probe target with a trailing comma fixed"
  },
  {
   "commit": "105413da19d8",
   "message": "researcher@php.newsroom: probe and analysis 21:05 UTC; rendered DOM kept only with the screenshot and under 1 MB (pushes over ~30 min were being cut); push retries 8"
  },
  {
   "commit": "5c63cc10b0f3",
   "message": "researcher@php.newsroom: pass 20261022T2053Z"
  },
  {
   "commit": "21c2b64f0b9a",
   "message": "cyber@php.newsroom + researcher@php.newsroom: compromise leads chased (Valtec resolved: not PHP; GMO FX VPS compromise, cause unstated; ČVUT attack stopped, success unconfirmed; DMM unstated); appliance bulletins captured (Palo Alto PAN-OS, QNAP, Cisco, Fortinet); 5 ledger records; probe and series runs"
  },
  {
   "commit": "202f981c32cf",
   "message": "researcher@php.newsroom: languages pass (339 non-English pages read, 568 new items with verbatim quotes, translations/ and index/foreign.json, index/translation-demand.json); stats pipeline (taxonomy/stats-sources.json, series/, probes/ of 295 named sites, analysis/, contradictions/ seeded with 7); 15 pages moved out of country 'impact'; docs/workflows.md"
  }
 ],
 "pages": 1286,
 "publishers": 946,
 "country": {
  "us": 285,
  "int": 217,
  "nl": 76,
  "fr": 49,
  "de": 48,
  "gb": 44,
  "kr": 44,
  "jp": 37,
  "au": 33,
  "tr": 33,
  "it": 30,
  "id": 25,
  "be": 24,
  "br": 24,
  "ch": 22,
  "ar": 20,
  "in": 20,
  "ca": 18,
  "eg": 17,
  "es": 15,
  "at": 14,
  "hk": 13,
  "pl": 11,
  "ro": 11,
  "th": 11,
  "cz": 10,
  "vn": 10,
  "pt": 9,
  "sg": 9,
  "ie": 8,
  "sa": 8,
  "eu": 7,
  "fi": 7,
  "nz": 6,
  "hu": 5,
  "lv": 5,
  "tw": 5,
  "za": 5,
  "bg": 4,
  "co": 4,
  "lu": 4,
  "mx": 4,
  "se": 4,
  "ua": 4,
  "cn": 3,
  "gr": 3,
  "ae": 2,
  "ee": 2,
  "il": 2,
  "lt": 2,
  "my": 2,
  "uy": 2,
  "ai": 1,
  "cl": 1,
  "dk": 1,
  "io": 1,
  "no": 1,
  "pe": 1,
  "re": 1,
  "sk": 1,
  "tn": 1
 },
 "sector": {
  "news": 656,
  "affected": 182,
  "aggregator": 140,
  "cert": 94,
  "tech-press": 50,
  "security-vendor": 30,
  "registry": 29,
  "reference": 24,
  "project": 18,
  "social": 17,
  "community": 16,
  "weaponisation": 12,
  "research": 9,
  "ai-lab": 3,
  "cloud": 3,
  "government": 2,
  "tool": 1
 },
 "lang": {
  "en": 579,
  "fr": 91,
  "de": 77,
  "nl": 61,
  "es": 59,
  "ko": 44,
  "pt": 40,
  "ar": 36,
  "it": 34,
  "tr": 34,
  "ja": 30,
  "id": 27,
  "zh": 21,
  "cs": 17,
  "th": 17,
  "ro": 15,
  "pl": 14,
  "vi": 13,
  "fi": 9,
  "hu": 8,
  "lv": 8,
  "bg": 7,
  "uk": 7,
  "sv": 6,
  "el": 5,
  "ms": 5,
  "lt": 4,
  "nb": 4,
  "sk": 4,
  "et": 3,
  "he": 3,
  "da": 2,
  "hr": 1,
  "sl": 1
 },
 "access": {
  "open": 1101,
  "bot-challenge": 91,
  "down": 58,
  "paywalled": 21,
  "gone": 10,
  "unchecked": 3,
  "login-wall": 2
 },
 "tiers": {
  "A": 74,
  "B": 876,
  "C": 16
 },
 "snapshots": 13604,
 "graphs": 13604,
 "files": 104886,
 "world_graph": {
  "nodes": 2344,
  "edges": 4670
 },
 "access_classes": [
  {
   "id": "open",
   "means": "Served the content to an anonymous browser."
  },
  {
   "id": "paywalled",
   "means": "Subscription press we hold no licence for. Either it served a subscription or registration wall instead of the content, or (for a publisher marked paywall in its page.json) it refused the anonymous browser with 401 or 403 before any wall. Counted apart from bot-challenge since 22 October 2026."
  },
  {
   "id": "bot-challenge",
   "means": "Served a bot or browser challenge (Cloudflare, Akamai, DataDome, PerimeterX, Vercel). The challenge page's hash is kept as the record."
  },
  {
   "id": "login-wall",
   "means": "Wants a signed-in account (some social posts)."
  },
  {
   "id": "geo-blocked",
   "means": "Refused because of where the request came from."
  },
  {
   "id": "gone",
   "means": "404 or 410: the page no longer exists at this address."